{
  "title": "Mémoire Master 2 - Impact du stress sur l'intention de turnover chez les jeunes embauchés",
  "locale": "fr",
  "dateMin": 1609455600000,
  "dateMax": 1625090400000,
  "answerCount": 30,
  "questions": [
    {
      "title": "Le nombre de projets ou de missions que j'ai à réaliser.",
      "type": "CHECKBOXES",
      "required": true,
      "answerOptions": [
        {
          "type": "FIXED",
          "value": "1",
          "probability": 0.115
        }, {
          "type": "FIXED",
          "value": "2",
          "probability": 0.154
        }, {
          "type": "FIXED",
          "value": "3",
          "probability": 0.385
        }, {
          "type": "FIXED",
          "value": "4",
          "probability": 0.346
        }, {
          "type": "FIXED",
          "value": "5",
          "probability": 0
        }
      ]
    }
  ]
}
